SYNTAX	DESCRIPTION	CLASS	CATEGORY	KEYWORDS
/x∊y	Indices of all cells in x that appear in same-rank array y	Expression	Indices	locate find membersof positionsof locating cells items location
∊/j1	Change lengths j1 of sublists to starting indicators	Expression	Data	partitions change converting conversion segments
⊐˜y	Index of first instance of each major cell	Tacit	Search	items elements indicesof location 1st
⊑n1⊐1	Index of first 1 in n1	Expression	Search	indexof one locate find positionof location 1st
∧⎉1 y	Sort each row ascending	Tacit	Ordering	up increasing sorting reordering
∨⎉1 y	Sort each row descending	Tacit	Ordering	down decreasing sorting reordering
<⎉1 y	Nest sub-arrays from last axis	Tacit	Structural	spike downarrow subarrays dimension
x ∾⎉1 y	Join along last axis	Tacit	Structural	concatenate juxtapose horizontally dimension row-wise rowwise by connect join
x1 ∾⎉1 y2	Prefix list to each row of table	Tacit	Structural	prepend rows list table
x2 ∾⎉1 y1	Postfix list to each row of table	Tacit	Structural	append rows list table
≍⎉0 y	Increment rank by inserting a new dimension after the trailing one	Tacit	Structural	additional dimensions axes axis items elements cells extend shape ending last columnmatrixfromvector
≍⎉1 y	Increment rank by inserting a new dimension before the last one	Tacit	Structural	additional dimensions axes axis items elements cells extend shape ending last
m1 F⎉0‿1 n2	Apply F between list m1 and each column of n2	Tacit	Function Application	rank suffixagreement columns distribute columwise column-wise list dimensions axes vertically columnwise
⌽⎉1 y	Reverse last axis of y	Tacit	Structural	circlestile reversing dimension
a1 /⎉1 y	Filter columns of y according to mask a1	Tacit	Selection	compressing slash solidus selecting cells items horizontally across bitmask bit-mask
i1 /⎉1 y	Replicate along last axis of y	Tacit	Selection	compressing slash solidus copying repeatingeachcolumns dimension horizontally replicating rowwise row-wise across
x ∊⎉1 y	Which elements of x belong to corresponding row of y (≠x ↔ ≠y)	Tacit	Search	testif memberof isin membership containedin has cells items
x ⊐⎉1 y	Indices of elements of x in corresponding rows of x	Tacit	Search	indexin indexof find locate positionof rowwise row-wise locating cells items location horizontally
F◶0‿G y	Sequential AND test (F∧G with shortcutting)	Tacit	Function Application	lazyevaluation sequentialtestif adjacentguard && shortcutting short-circuit minimal McCarthy
F◶G‿1 y	Sequential OR test (F∨G with shortcutting)	Tacit	Function Application	lazyevaluation sequentialtestif adjacentguard || shortcutting short-circuit minimal McCarthy
1=x⍋y	Is y within the range [ x_0 , x_1 )	Expression	Data	testif ≤y< ≤x< tao totalarrayordering interval inrange?
1≠x⍋y	Is y outside the range [ x_0 , x_1 )	Expression	Data	testif >y≥ >x≥ tao totalarrayordering interval outsiderange?
⊑⍋y	Index of smallest cell in y (earliest index for ties)	Expression	Ordering	find locate positionof minimum lexicographically lexically locating location lesser smaller smallest lowest least
⍋x⊐y	Grade up of y according to key x	Expression	Ordering	custom sort order ascending
⍋⍋y	Rank cells of y, giving a permutation with the same ordering (first is lower in a tie)	Expression	Ordering	ascending rising up ordinals cardinals list rownumber
⊑⍒y	Index of largest cell in y (earliest index for ties)	Expression	Ordering	find locate positionof maximum lexicographically lexically locating location greater larger bigger greatest biggest largest highest
⍒x⊐y	Grade down of y according to key x	Expression	Ordering	custom sort order descending
⍋⍒y	Rank cells of y descending (first is lower-ranked in a tie)	Expression	Ordering	falling down ordinals cardinals list rownumber
⍉>y1	Convert inverted table to table (character data as lists of lists)	Expression	Structural	matrix tables transforming transformation change changing into un-inverting un-inversion un-vertion unverting unversion unvertion
0‿0⍉y2	Main diagonal of matrix	Expression	Selection	table
⌽⍉y2	Rotate 90° clockwise	Expression	Structural	turning rotating rotation -90° ¯90° quarter-turn quarterturn
⍉⌽y2	Rotate 90° counter-clockwise	Expression	Structural	turning rotating rotation -90° ¯90° quarter-turn quarterturn counterclockwise
F⌾⍉y	Apply action F defined on rows to columns instead	Tacit	Function Application	
⍉⎉2 y	Transpose every submatrix of y	Tacit	Structural	cant ^T ⸆ ᵀ sub-matrix sub-table subtable planes
@+0	Null character (NUL)	Constant	Text	\0 ^@ U+00 0x00h \u00 ≢00
@+10	Line Feed (LF)	Constant	Text	\n ^j U+0D 0x0Ah \u0A ≢0A newline linefeed
@+11	Vertical Tab character (VT)	Constant	Text	\v ^K U+00 0x00h \u00 ≢00 tabulation
@+12	Form Feed character (FF)	Constant	Text	\F ^L U+00 0x00h \u00 ≢00
@+127	Delete character (DEL)	Constant	Text	\e ^[ U+0A 0x0Dh \u0D ≢0D carriagereturn
@+13	Carriage Return character (CR)	Constant	Text	\r ^m U+0D 0x0Dh \u0D ≢0D carriagereturn
@+26	End-Of-File character (EOF)	Constant	Text	SUB ^z U+0A 0x0Dh \u0D ≢0D carriagereturn
@+27	Escape character (ESC)	Constant	Text	\e ^[ U+0A 0x0Dh \u0D ≢0D carriagereturn
@+7	Bell character (BEL)	Constant	Text	\a ^G U+07 0x07h \u07 ≢07 beep
@+8	Backspace character (BS)	Constant	Text	\b ^H U+08 0x08h \u08 ≢08
@+9	Horizontal Tab character (HT)	Constant	Text	\t ^i U+00 0x00h \u00 ≢00 tabulation
@+i	Characters from Unicode code point numbers	Expression	Text	utf-8 utf8 utf-16 utf16 utf-32 utf32 ucs-4 ucs4 ucs-2 ucs2 iso10646 ord() num() chr() char() ascii latin-1 windows-1252 ansi mapping UniversalCodedCharacterSet UniversalCharacterSet codepoints code-points converting change changing
c-@	Characters to Unicode code point numbers	Expression	Text	utf-8 utf8 utf-16 utf16 utf-32 utf32 ucs-4 ucs4 ucs-2 ucs2 iso10646 ord() num() chr() char() ascii latin-1 windows-1252 ansi mapping UniversalCodedCharacterSet UniversalCharacterSet codepoints code-points converting change changing
expr⊣name←y	Combining two lines into one	Expression	Syntax	lev lefttack where
name∾↩y	Fast: 'name' redefined to be its value with y catenated along its first axis	Expression	Structural	amend append extend accumulate concatenate dimension 1st
2×π	tau (2 pi)	Constant	Mathematical	Palais'circleconstant Palais'constant Palaisconstant 6.283185307179586476925286766559006 τ 𝜏
n+m×0=n	Replace zeroes in n with corresponding elements of m	Expression	Data	substitute merge amend replace update 0s zeros cells items falses falsehoods
∾a×<b	Expand a by replacing 1s with same-rank array b, and 0s with 0×b	Expression	Structural	nest fractal replace copies
1‿¯1×<n	±n by juxtaposition	Expression	Arithmetic	plusminus
¯1‿1×<n	∓n by juxtaposition	Expression	Arithmetic	minusplus
1+2×↕j0	Odd integers from 1 to 2×j0	Expression	Sequences	numbers 1st
m0+n0×↕j0	Arithmetic progression list: j0 elements starting at m0 with step n0	Expression	Sequences	list sequence seq() cells items
i0↕↕≠y	Moving width-i0 window of indices for array y	Expression	Indices	
¯128+256|128+j	Convert from unsigned short integers to signed short integers	Expression	Fixed-Width	datarepresentation converting change changing
↕¯1↑≢y	Indices for trailing axes of y	Expression	Indices	shape dimension ending
x↑˜≠y	Truncate x or extend with fills to have the same length as y	Expression	Structural	compatibility sameheight adjust column-wise columnwise table
<˘0↓y	List of major cells for any rank	Expression	Structural	vectorise vectorize list dimensions higher high-rank any-rank highrank anyrank items elements axes
¬2|/j1	Alternating sequence of j1_0 ones, j1_1 zeros, j1_2 ones, …	Expression	Sequences	1s 0s zeroes naughts falses falsehoods trues truths
x2∾y¨⊏x2	Append element y to each column of table x2	Expression	Structural	vertically ontop atop extend with over merge join concatenate columns table
↕¯1⊑≢y2	All column indices of y2	Expression	Indices	enumerate columns
⊑/x≠y	Index of first differing element in x and y	Expression	Search	indexin indexof find locate positionof unequal different 1st locating cell item difference location
0=≠⥊y	Is y an empty array?	Expression	Structural	testif isempty? isvoid? isnull?
1=≠⥊y	Is y a singleton (array with only one element)?	Expression	Array	testif unit? sole? one?
>i1⥊<y	Shape i1∾≢y array with copies of y for cells	Expression	Structural	copy repeat repetitions duplicate reshape
∾i1⥊<y	Repeat the whole of y the given number of times along each leading axis	Expression	Structural	copy repeat repetitions duplicate reshape tile tesselate
⌽‿i0⥊y1	Reshape y1 to i0-column table (filled row-wise)	Tacit	Structural	table horizontally rowwise columns
i0‿⌽⥊y1	Reshape y1 to i0-row table (filled row-wise)	Tacit	Structural	table horizontally rowwise rows
⥊x1≍˘y1	Merge equal-length lists x1 and y1 alternately	Expression	Structural	faro dovetail zipper zipping merge interweave interweaving interleave interleaving shuffle shuffling meshing lists zip()
⊑1↑0⥊y	Fill element of y	Expression	Structural	fillelement padding 0s zeroes type cell item blanks falses falsehoods
⊑⌽⥊y	The last element of y	Expression	Selection	cell element
+∘-n	Negate real part (“real conjugate”)	Tacit	Complex Numbers	
-∘+n	Mirror complex n across y-axis	Tacit	Complex Numbers	negatereal mirroring reflecting reflection
m×∘-n	Sign of difference (¯1:m is smaller, 0:m=n, 1:m is bigger)	Tacit	Data	signum cmp() <=> >-< spaceship space-ship three-way compare comparing comparison
m⌊∘÷n	Integer Division	Tacit	Arithmetic	intdiv() ≢ // divmod()
a¬∘∧b	Logical NAND	Tacit	Boolean	shefferstroke notand andtilde carettilde alternativedenial Dpq ⊼ gate
m¬∘∧n	Probabilistic NAND	Tacit	Statistical	fuzzy probability chance shefferstroke notand alternativedenial Dpq ⊼
a¬∘∨b	Logical NOR	Tacit	Boolean	peirce'sarrow quine'sdagger ampheck neithernor jointdenial Xpq ⊽ neither-nor gate †
↕∘≠y	Indices of Major Cells of y	Tacit	Indices	enumerate number count items elements
↕∘≠y2	All row indices of table y2	Tacit	Indices	enumerate rows table
m0↕∘⋈n0	Catalogue of all pairs from ↕m0 and ↕n0	Tacit	Indices	pairings tuples table matrix
↕∘≢y	All indices of y, as a matching-shape array	Tacit	Indices	indicesof
m|∘-n	Absolute distance between x and y	Tacit	Geometric	magnitudeof cartesian
∘‿2⥊y1	Reshape list y1 into a two-column table	Expression	Structural	2-column table list
+⊸=n	Is n a real number?	Expression	Complex Numbers	testif
⌊⊸=n	Is n integer?	Expression	Arithmetic	testif whole number?
+⊸≠n	Is n complex but not real?	Expression	Complex Numbers	testif
¬⊸-n	Convert 0 to 1 and 1 to -1 with a linear transformation	Tacit	Arithmetic	affine unit interval boolean sign reverse negative
m¬⊸∧n	Probabilistic converse nonimplication	Tacit	Statistical	fuzzy probability chance ⇍ Mpq
a¬⊸∨b	Probabilistic implication	Tacit	Statistical	fuzzy probability chance materialconditional materialconsequence implies implying materialimplication therefore ∴ ⇒ Cpq
»⊸<b	Boolean first ones in each group of ones	Tacit	Partitioning	beginningsofruns trues truths 1st binary base-2 base2 sequences blocks
↕⊸÷j0	Start points when [0,1) is split into j0 intervals	Tacit	Sequences	unit normalized steps linear divide
↕⊸∾j0	Integers from 0 to j0 inclusive	Tacit	Sequences	unsigned natural whole numbers additional extra
×⊸|n	Signed fractional part of n (e.g. ¯0.4 for ¯2.4)	Expression	Arithmetic	decimals
a0-⊸↓y	Conditional drop of last element of y	Tacit	Structural	trailing cell item delete remove ending without
i0-⊸↑y1	Pad y1 on the left to width i0	Tacit	Structural	extend left-align leftalign text
⌽⊸≡d1	Is d1 a palindrome?	Expression	Text	testif
x≠⊸⥊y	Array with shape of x and content of y	Tacit	Structural	reshape mould mold form fill
i1/⊸⊔y	Cut y into partitions of length i1 (+´i1 ↔ ≠y)	Tacit	Structural	chop split separate chunks segments
-⟜¬n	Convert range [0,1] to [-1,1] with a linear transformation	Tacit	Arithmetic	affine unit interval boolean sign
m∧⟜¬n	Probabilistic nonimplication	Tacit	Statistical	fuzzy probability chance abjunction ⇏ butnot Lpq
a∨⟜¬b	Probabilistic converse implication	Tacit	Statistical	fuzzy probability chance because ∵ ⇐ if converseconditional Bpq reverseimplying
>⟜«b	Boolean last ones in each group of ones	Tacit	Partitioning	endsofruns 1s trues truths binary base-2 base2
×⟜|n	Square without changing sign	Tacit	Arithmetic	remove change converting conversion
m∧○¬n	Probabilistic NOR	Tacit	Statistical	fuzzy probability chance peirce'sarrow quine'sdagger ampheck neithernor jointdenial Xpq ⊽
x≡○∧y	Are x and y permutations of each other?	Tacit	Data	testif permutation? permutationof?
⌽⌾⥊y2	Rotate 180°	Tacit	Structural	turning rotating rotation half-turn halfturn
j0↑/⁼i	Boolean list of length j0 with ones in locations i	Expression	Boolean	inversion 1s trues truths list binary base-2 base2
1‿¯1×⌜n	±n as two major cells of the result	Expression	Arithmetic	plusminus dimensions axes
¯1‿1×⌜n	∓n as two major cells of the result	Expression	Arithmetic	minusplus dimensions axes
⊢⌜˜y1	Square matrix with y1 as rows	Tacit	Structural	tomatrixof table
⊣⌜˜y1	Square matrix with y1 as columns	Tacit	Structural	tomatrixof table
+´a1×n1	Summation over subsets of n1 specified by a1	Expression	Partitioning	
+´m1×n1	Dot product of vectors m1 and n1	Expression	Linear Algebra	dotproduct vectorproduct ∙ ⋅ · multiplication multiply
⌈´m1×n1	Maximum of n1 with weights m1	Expression	Data	greatestif largest biggest
⌊´m1×n1	Minimum of n1 with weights m1	Expression	Data	smallest least
+´m1÷n1	Sum of reciprocal series m1÷n1	Expression	Mathematical	sequence
-´m1÷n1	Sum of alternating reciprocal series m1÷n1	Expression	Mathematical	sequence
+´x1=y1	Number of equal corresponding elements in x1 and y1	Expression	Data	cells items lists pairwise matches
+´x1≠y1	Hamming distance	Expression	Data	edit
×´≢y	Number of elements (bound) of array y	Expression	Array	tallyall ≢, numberofelements numberofitems howmanyelements howmanyitems whole scalars countall ×⌿≢ ≠, cells
=´≢y2	Is y2 a square matrix?	Expression	Linear Algebra	square? table
⌈´|n1	Largest magnitude found in n1	Expression	Data	rowwise horizontally biggest greatestif maximum absolute value
⌊´|n1	Smallest magnitude found in n1	Expression	Data	rowwise horizontally least minimum absolute value
+´⥊b	Number of trues	Expression	Boolean	sumall howmanytrue count tally 1s ones truths
+´⥊n	Sum all elements in an array	Expression	Data	sumall +⌿, grandtotal sumitems cells
∧´⥊b	Are all true?	Expression	Boolean	testif forall ∀ ⋀ givenany tautology universalquantification
∨´⥊b	Are any true?	Expression	Boolean	testif forany thereexists forsome existentialquantification ∃ ⋁ any?
∧`x=y	Indicate leading elements that are equal	Expression	Search	show matching onleft cells items masking indicating start beginning
∧`x≠y	Indicate leading elements that are unequal	Expression	Search	show different onleft cells items masking indicating start beginning
b∨≠`b	Parity with connectors: fill between pairs of ones	Tacit	Boolean	1s trues truths
b<≠`b	Places between pairs of ones	Tacit	Boolean	1s trues truths
+`»j1	Starting positions of sublists having lengths j1	Expression	Partitioning	sub-vectors sub-lists sublists
+`↕j0	First j0 triangular numbers	Expression	Sequences	oeisA000217 oeisA217 1st
F`⌾⌽y	Scan from end with F	Tacit	Function Application	cumulativereduce rowwise backscan backwards suffix scanning row-wise horizontally trailing ending
+`⁼n	Difference of adjacent pairs with seed value	Tacit	Data	differences deltas changes steps
≠`⁼b	Convert binary to reflected Gray code	Tacit	Boolean	base-2 base2 Conversion converting change changing
⟨⟩⥊y	First element of y as a unit	Expression	Selection	1st cell item top-left topleft northwest north-west NW
⋆×˜n	Limit of nominal rate n when continuously compounded	Expression	Finance	interest
a¬⊸⋆n	Conditional change of elements of n to one according to a	Tacit	Data	1 cells items changing converting conversion
×´n1⋆b1	Product of the elements in n1 where b1 is true	Expression	Data	sub-sets
m×n⋆¯1⋆a	Conditionally multiply (where a=0) or divide (where a=1) m by n	Expression	Data	per-element item cell
¯1+m√1+n	Annual rate to modal rate	Expression	Finance	
i1∊↕≠y	Starting points for y in indices pointed by i1	Expression	Partitioning	segmented partitioned starts beginnings
∊/1+n1	Boolean list with n1 zeros after each 1	Tacit	Boolean	runs binary base-2 base2
1«∊/j1	Change lengths j1 of sublists to ending indicators	Expression	Partitioning	partitions trailing change converting conversion segments
⊑/x∊y	Index of first occurrence in x of any cell of y	Expression	Search	cell element find locate 1st position location
∧´∊y	Are all major cells of y distinct?	Expression	Search	testif alldifferent? allunequal? noduplicates? nodups? items elements alldistinct? allunique?
∧´x1∊y1	Is x1 a subset of y1?	Expression	Sets	testif subset? containedin ⊆
∨´x1∊y1	Do x1 and y1 have any elements in common?	Expression	Search	testif anyshared? anycommon? cells items
i1∊+`b1	Mask to get sublists with indices i1 as indicated by b1	Expression	Selection	sub-vectors masking indicating bitmask bit-mask
∧⊸⊐y	Rank y ascending; tied cells share the lowest rank	Tacit	Ordering	rising up ordinals cardinals list minrank
∨⊸⊐y	Rank y descending; tied cells share the lowest rank	Tacit	Ordering	falling down ordinals cardinals list minrank
x⌽⊸⊐y	Last indices in x of major cells y, counted from the rear	Tacit	Search	indexin indexof find locate positionof locating items elements location
/⁼⊐y	Count of occurrences of each unique major cell	Expression	Data	elements items how many repetitions times repeated occurrences statistics
⌈´x⊐y	Index of last occurrence in x of any major cell of y	Expression	Search	element find locate location indexin indexof positionof locating cells items
⌊´x⊐y	Index of first occurrence in x of any major cell of y	Expression	Search	element find locate 1st location indexin indexof positionof locating cells items
m1(F⎉1)n2	Apply F between list m1 and each row of n2	Tacit	Function Application	rank prefixargeement rows distribute rowwise row-wise list dimensions axes horizontally
x(F⎉0)y	Run F on units	Tacit	Function Application	apply
+˝⎉1 n	Row-wise sum of n	Tacit	Data	summation enlargedsigma bigsigma capitalsigma ∑ Σ sum() horizontally rowwise
×˝⎉1 n	Row-wise product of n	Tacit	Data	enlargedpi bigpi capitalpi ∏ Π horizontally rowwise
⌈`⎉1 n	Row-wise progressive maxima	Tacit	Data	running cumulative scan rowwise horizontally
⌊`⎉1 n	Row-wise progressive minima	Tacit	Data	running cumulative scan rowwise horizontally
𝕨0⊘1𝕩	Was this block function called monadically?	Expression	Function Application	arity ambivalent ambivalence variadic leftargument 900⌶ monadic?
x⍋⊸⊏y	Sorting y according to x	Tacit	Ordering	ordering
x⍋⌾⋈y	Is x lexically less than or equal to y?	Tacit	Ordering	testif tao totalarrayordering notafter precedesorequivalentto ≼ ⊁ lexicographically
/⁼x⍋y	Distribution of y into intervals with cut-offs x	Expression	Data	bins groups ranges buckets
a1⍒⊸⊏y	Moving cells of y indicated by a1 to the start of y	Tacit	Structural	conditional promote promotion items elements beginning leading
x⍒⌾⋈y	Is x lexically greater than or equal to y?	Tacit	Ordering	testif tao totalarrayordering notbeforefollowsorequivalentto ≽ ⊀ lexicographically
1<≠⍷y	Are any major cells of y different?	Expression	Search	testif anydifferent? anyunequal? anyunique? items elements
1≥≠⍷y	Are all major cells of y identical?	Expression	Search	testif allsame? allequal? nounique? items elements allidentical
⍷⊸≡y	Are all major cells of y distinct?	Tacit	Search	testif alldifferent? allunequal? noduplicates? nodups? items elements alldistinct? allunique?
⌽⍉⌽y2	Reflect counter-diagonally	Expression	Structural	mirroring reflecting reflection counterdiagonally
<˘⍉y2	Table to list of column lists (inverted table)	Expression	Structural	split table lists into columns vertically column-wise columnwise boxed enclosed matrix transforming transformation change changing inverting inversion
⍉∘+n2	Conjugate Transpose	Tacit	Linear Algebra	self-adjoint selfadjoin Yᴴ y^H y† y^† Aᴴ a^H a† a^†
⍉⊸≡y2	Is y2 a symmetric matrix?	Tacit	Linear Algebra	testif
⟨⟩⍉y	Convert y to array (enclose if atom)	Expression	Structural	leftshoeunderbar encloseifsimple conditionalenclose boxsimple eis condenclose
@+13‿10	Carriage Return-Line Feed pair (CRLF)	Constant	Text	\r\n U+0DU+0A 0x0D0x0A \u0D\u0A ≢0D≢0A enter linebreak windows
name1‿name2⌽↩	Swap variable values	Expression	Assignment	leftarrow get are copula let redefine redefining list renaming denote mean unpacking redistributing redistribution vector exchange exchanging swapping variables
32+1.8×n	Celsius to Fahrenheit	Expression	Specialty	°Fahrenheit °Celsius f2c() ftoc() converting change changing
π×m×n	Area of cone with height m and radius n, excluding base	Expression	Geometric	lengths bottom
⌊0.5+n	Round to nearest integer, ties towards ∞	Expression	Rounding	precision favoring whole number closestinteger nearestinteger nint()
π×n⋆2	Area of circle with radius n	Expression	Geometric	length
'0'+d	Translate digit numbers to characters	Expression	Text	base-2 base2 binary Boolean decimal converting change changing
d-'0'	Translate character digits to numbers	Expression	Text	base-2 base2 binary Boolean decimal converting change changing
d-'a'	Convert lowercase letters to their positions in the alphabet	Expression	Text	nth ordinals Conversion converting change changing
'''	Quote character	Constant	Text	apostrophe ’ U+27 0x27 ≢27 quotationmark prime singlequoted string symbol escape literal
(a×i1)↓y	Conditional drop of i1 elements from array y only if a is true	Expression	Structural	major cells items delete remove without
∾↑¨↓y1	All possible slices of y1 ordered by starting index	Expression	Selection	sub-strings substrings sub-vectors sub-sequences subsequences segmented sub-lists partitioned sublists
(a1+1)/y	Duplicate y cells where indicated by a1	Expression	Structural	replicate double items elements
(i0⥊0)↓y	Increase rank of y to i0	Expression	Structural	number dimensions axes
1↓⥊x0∾˘y2	Table to list using x0 as delimiter	Expression	Structural	vectorise vectorize serialise serialize list table
1↓⥊x0≍˘y1	Insert x0 in between each pair of elements of list y1	Expression	Structural	combine merge list string character joiner joining merging combining
⊑1↑0⥊<y	Convert to fill element, replacing numbers with 0 and characters with space	Expression	Structural	prototype ⍷ datatypeof 0s zeroes spaces blanks zeros falses falsehoods
<∘∾˘y2	Turn a table of lists into a list of lists by joining each row	Tacit	Structural	format merge along rows concatenate lines each
1«»⊸≠y1	Which elements differ from next ones	Expression	Data	testif neighbouring neightbors neighboring neighbours neighbors righthand cells items 1s trues truths
1«»⊸≠y1	Indicate end of each group of consecutive equal elements	Expression	Partitioning	runs sequences Boolean major cells items indicate masking indicating trailing different from next
2×↕⊸∾j0	Even integers from 0 to 2×j0	Expression	Sequences	numbers 1st
∾x1⊸∾¨y1	Join list of lists y1 using separator x1, including leading separator	Expression	Structural	text with using string list joiner combiner joining combining merge merging
i0-⊸↑j0⥊1	Suffix List: length i0 with j0 ones on the right, the rest zeroes	Expression	Sequences	1s 0s zeros Is𝕩Js falses falsehoods trues truths
a1/¨⊸⊔y	Partition y along each axis by list of partition length lists a1	Tacit	Structural	chop split cut separate chunk segmented sub-matrices submatrices sub-tables subtables partitioned block-matrix dimensions blockmatrix
1»≠⟜«y1	Which elements differ from previous ones	Expression	Data	testif neighboring neighbours neighbors lefthand cells items 1s trues truths
1»≠⟜«y1	Indicate start of each group of consecutive equal elements	Expression	Partitioning	runs sequences Boolean major cells items indicate masking indicating starting starts beginnings leading different from previous
-⟜»/i1	Segment lengths given the number of segments that end at each position	Expression	Partitioning	chunk trailing converting change changing segments partitions
i0⥊⟜0⊸»y1	Shift y1 right by i0, padding on left	Tacit	Selection	rightshift list
i0⥊⟜0⊸«y1	Shift y1 left by i0, padding on right	Tacit	Selection	leftshift list
¬j0↑/⁼i	Boolean list of length j0 with zeros in locations i	Expression	Boolean	zeroes 0s falses falsehoods list binary base-2 base2
⌈⌜˜↕j0	Maximum table of 0…j0-1	Expression	Arithmetic	matrix
=⌜˜↕j0	Identity matrix of order j0	Expression	Linear Algebra	unitmatrix table
≠⌜˜↕j0	Non-diagonal matrix of order j0	Expression	Linear Algebra	nondiagonal table
<⌜˜↕j0	Upper triangular matrix without diagonal: j0 by j0	Expression	Linear Algebra	triangle NE northeast north-east table remove strict
>⌜˜↕j0	Lower triangular matrix without diagonal: j0 by j0	Expression	Linear Algebra	triangle SW southwest south-west table remove strict
≤⌜˜↕j0	Upper triangular matrix with diagonal: j0 by j0	Expression	Linear Algebra	triangle NE northeast north-east table
