SYNTAX	DESCRIPTION	CLASS	CATEGORY	KEYWORDS
x •Import d1	Load BQN script from path d1, with •args x	System	Execution	include library run execute
x1 •BQN d1	Evaluate string d1 as BQN code, with •state x1	System	Execution	eval() run call
•MakeRand m0	Random number generator (behaves like •rand) initialized with seed m0	System	Random	RNG rnd pseudorandominteger pseudo-randomfloat srandomness source randomlink deterministic reproducible reproduce seeded predictable
•MonoTime y	Monotonically-increasing time counter in seconds, for relative measurement	System	Time	
•Import d1	Load BQN script from path d1, recalling saved result if already loaded	System	Execution	include library run execute
•BQN d1	Evaluate source string d1 as BQN code	System	Execution	eval() run call
•Decompose g	Split compound function g into parts	System	Properties	
•Delay n0	Wait n0 seconds	System	Time	await sleep pause idle
•Exit y	Exit the running BQN process, with return code y	System	Execution	quit terminate level stop close
•Fmt y	Format value y for printing	System	I/O	itoa tostringify() totext() tostring()
•Glyph g	Glyph character of primitive g	System	Properties	squiggle builtin
•Out d1	Print string d1, and trailing newline, to stdout	System	I/O	echo puts
•ParseFloat d1	Convert d1 from string to number, supporting scientific notation	System	Text	decimal Conversion converting cast integer strtod atoi
•ReBQN y	Create BQN-like evaluation function using options namespace y	System	Execution	extend extension replace new
•Repr y	Source code representation of BQN value y, if possible	System	I/O	uneval itoa totext() numbers numerics converting into marshal serialize pickle
•SH y1	Execute shell command given by strings y1 (such as "mv"‿"old"‿"new")	System	Interface	cli evaluate call executable run operatingsystem commandprocessor linux macos bash dash pdksh mksh zsh tcsh fish rc scsh wish
•Show y	Format and print BQN value y	System	I/O	echo log debug display
•Type y	Type of y: 0 array, 1 number, 2 character, 3 function, 4 1-modifier, 5 2-modifier, 6 namespace	System	Properties	kind
•UnixTime y	Current Unix time in seconds	System	Time	now timestamp datetime
•args	Arguments passed to the current script by command line or BQN caller	System	Execution	startup shell argv cmdline cli
•state	The list ⟨•path, •name, •args⟩ of execution state	System	Execution	bqn
•name	Name of the file where this system value appears	System	Execution	this here script location
•path	Path of the file where this system value appears	System	Execution	this here script location
•primitives	List of primitives as glyph‿value pairs	System	Execution	builtins
•wdpath	The shell's current working directory path	System	Execution	pwd folder location where
@ •FFI y1	Load native libc function	System	Interface	stdlib standardlibrary
m i1•bit._add n	Wrapping integer addition (+) of m and n with widths given by i1 	System	Bitwise	greek cross plus addition
m i1•bit._and n	Bitwise and (∧) of m and n with bit widths given by i1 	System	Bitwise	gate conjunction caret wedge hat circumflex Kpq ^
m i1•bit._sub n	Wrapping integer subtraction (-) of m and n with widths given by i1 	System	Bitwise	minus dash hyphen subtraction difference −
m i1•bit._mul n	Wrapping integer multiplication (×) of m and n with widths given by i1 	System	Bitwise	cross times multiplication ∙ ⋅ · product
m i1•bit._or n	Bitwise or (∨) of m and n with bit widths given by i1 	System	Bitwise	gate disjunction vel alternation Caron hacek invertedcircumflex checkmark hachek Apq
m i1•bit._xor n	Bitwise exclusive or (≠) of m and n with bit widths given by i1 	System	Bitwise	gate exclusivedisjunction eor exor ⊕ ⊻ ⇎ Jpq
m •math.Atan2 n	2-argument arctangent, angle of vector m‿n relative to 1‿0	System	Trigonometry	phase
m •math.Comb n	Binomial function m choose n	System	Combinatorics	exclamation bang shriek binomial combinatorics countcombinations unordered selecting picking outof nCk C(n,k)
m •math.GCD n	Greatest Common Divisor of m and n	System	Number Theory	gcd() gcf() factor hcf() highest gcm() measure hcd Caron hacek invertedcircumflex checkmark hachek
m •math.Hypot n	Highest-precision hypotenuse length m+⌾(×˜)n	System	Geometric	correct accurate perfect rounding
m •math.LCM n	Least Common Multiple of m and n	System	Number Theory	least smallest lcm() denominator lcd() caret wedge hat circumflex ^
m0 •rand.Deal n0	A simple random sample of m0 elements of ↕n0	System	Random	srs draw without replacement removing
m0 •rand.Subset n0	A sorted random sample of m0 elements from ↕n0	System	Random	srs simple draw without replacement removing reservoir
m1 •file.Owner d1	Set owner user ID and group ID number of file d1	System	Files	directory directories folders ls list information vector chown
m1 •file.Permissions d1	Set permissions of file d1	System	Files	directory directories folders ls list information vector chmod
m1 •rand.Range n0	Shape m1 array of elements selected uniformly at random from ↕n0	System	Random	randominteger roll draw with replacement
c1 •file.At d1	Absolute path of file with path d1 relative to c1	System	Files	resolve canonicalize reduce extend
c1 •file.Bytes d1	Write raw bytes to file c1 (overwrites existing contents)	System	Files	store put dump cat save overwrite UTF-8
c1 •file.Chars d1	Write string d1 to file c1 (overwrites existing contents)	System	Files	store put dump cat save overwrite
c1 •file.Copy d1	Copy file d1 to c1	System	Files	copying
c1 •file.Lines x1	Write lines x1 to file c1 (overwrites existing contents)	System	Files	store put dump cat save overwrite vtv charvec charactervector textvector string
c1 •file.Rename d1	Rename file d1 to c1	System	Files	moving renaming
i1•bit._neg n	Fixed-width integer negation (-) of n with widths given by i1 	System	Bitwise	minus hyphen invert additiveinverse opposite dash negation signchange − negating
i1•bit._not n	Bitwise negation (¬) of n with bit widths given by i1 	System	Bitwise	tilde logicalnot logicalnegation logicalcomplement ~ negate inverting
•file.Modified d1	Time of last modification to file d1	System	Files	filepath directory directories folders ls list information vector when modified
•file.Name d1	File name from path d1	System	Files	parts
•file.Accessed d1	Time of last access to file d1	System	Files	filepath directory directories folders ls list information vector when previously accessed
•file.At d1	Absolute path of file d1	System	Files	resolve canonicalize reduce relative
•file.Basename d1	File name from path d1, with dot and extension removed	System	Files	parts
•file.Bytes d1	Return contents of file d1 as raw bytes	System	Files	get read fetch load UTF-8
•file.Chars d1	Return contents of file d1 as a string	System	Files	get read fetch load
•file.CreateDir d1	Create a directory with path d1	System	Files	mkdir md newfolder make
•file.Created d1	Time file d1 was created	System	Files	filepath directory directories folders ls list information vector when created
•file.Exists d1	1 if file d1 exists and 0 otherwise	System	Files	check there directory directories folders ls list information vector
•file.Extension d1	File extension, including leading dot, from path d1	System	Files	parts
•file.List d1	Return the list of filenames contained in directory d1	System	Files	directory directories folders ls list information vector
•file.Lines d1	Return lines of file d1 as a list of strings	System	Files	get read fetch load vtv charvec charactervector textvector string
•file.Owner d1	Owner user ID and group ID number of file d1	System	Files	directory directories folders ls list information vector userid user-id windows sid
•file.Parent d1	Path of containing directory of path d1	System	Files	parts
•file.Parts d1	List of parent, base name, and extension given path d1	System	Files	split divide
•file.Permissions d1	Permissions of file d1, as a 3-element list	System	Files	directory directories folders ls list information vector
•file.Remove d1	Delete file d1	System	Files	dcf delete expunge remove drop without removing erasing eliminate eliminating deleting
•file.RemoveDir d1	Recursively delete directory d1 and all contents	System	Files	directory directories folders dcf delete expunge remove drop without removing erasing eliminate eliminating deleting
•file.Size d1	Total size in bytes of file d1	System	Files	directory directories folders ls list information vector
•file.Type d1	A character from "fdlpsbc" indicating POSIX type of file d1	System	Files	filepath directory directories folders ls list information vector symbolic first-in-first-out character
•file.path	Equivalent to •path	System	Files	this here script location
•math.Asin n	Arcsine of n	System	Trigonometry	inverse arsin() asin() arcussinus sin⁻¹() sin^-1()
•math.Asinh n	Hyperbolic arcsine of n	System	Trigonometry	inverse arcsine asinh() arcsinh() arsinh() area sinh⁻¹() sinh^-1()
•math.Acos n	Arccosine of n	System	Trigonometry	inverse arccos() acos() arcuscosinus cos⁻¹() cos^-1()
•math.Acosh n	Hyperbolic arccosine of n	System	Trigonometry	inverse arccosine acosh() arccosh() arcosh() area cosh⁻¹() cosh^-1()
•math.Atan n	Arctangent of n	System	Trigonometry	inverse arctan() atan() arcustangens tan⁻¹() tan^-1()
•math.Atanh n	Hyperbolic arctangent of n	System	Trigonometry	inverse arctangent atanh() arctanh() artanh() area tanh⁻¹() tanh^-1()
•math.Cbrt n	Highest-precision cube root 3√n	System	Trigonometry	correct accurate perfect rounding
•math.Cos n	Cosine of angle n (radians)	System	Trigonometry	cos() cosinus
•math.Cosh n	Hyperbolic cosine of n	System	Trigonometry	cosh()
•math.Erf n	Error function of n (normalized integral of Gaussian)	System	Statistical	statistics erf() normal distribution sigmoid cdf cumulative
•math.ErfC n	Highest-precision complementary error function 1-•math.Erf n	System	Statistical	statistics erf() normal distribution sigmoid cdf cumulative
•math.Expm1 n	Highest-precision (⋆n)-1	System	Arithmetic	correct accurate perfect rounding
•math.Fact n	n factorial, or Gamma function of n+1	System	Combinatorics	pling exclamation bang shriek countpermutations combinatorics fact() gamma() Γ
•math.Log10 n	Highest-precision base-10 logarithm 10⋆⁼n	System	Arithmetic	correct accurate perfect rounding decimal
•math.Log1p n	Highest-precision ⋆⁼1+n	System	Arithmetic	correct accurate perfect rounding
•math.Log2 n	Highest-precision base-2 logarithm 2⋆⁼n	System	Arithmetic	correct accurate perfect rounding binary
•math.LogFact n	Highest-precision logarthm of factorial ⋆⁼•math.Fact n	System	Arithmetic	correct accurate perfect rounding
•math.Sin n	Sine of angle n (radians)	System	Trigonometry	sin() sinus
•math.Sinh n	Hyperbolic sine of n	System	Trigonometry	sinh()
•math.Tan n	Tangent of angle n (radians)	System	Trigonometry	tan() tangens
•math.Tanh n	Hyperbolic tangent of n	System	Trigonometry	tanh()
•rand.Deal n0	A random shuffle of ↕n0	System	Random	shuffling reorder
•rand.Range 0	A random real number in the interval from 0 to 1	System	Random	roll
•rand.Range n0	A number selected uniformly at random from ↕n0	System	Random	randominteger roll
•rand.Subset n0	A random sorted subset of ↕n0	System	Random	simple random sample srs length
x1‿y1 •bit._cast n	Cast n from bit representation y1 to x1 	System	Bitwise	
¯1-j	2's-complement bit-wise NOT	Expression	Bitwise	bitwise binary logicalnot logicalnegation logicalcomplement negate inverting inversion 2s two's twos
0×n	Zero array of shape, size, and structure of n	Expression	Data	zeroes zeros fill mold mould 0s falses falsehoods
100×n	Percentage corresponding to rate n	Expression	Statistical	conversion converting change changing
0⌈n	Ensure that n is non-negative by increasing negatives to zero	Expression	Data	clamp limit restrict
0⌊n	Ensure that n is non-positive by reducing positives to zero	Expression	Data	clamp limit restrict
n÷100	Rate corresponding to percentage n	Expression	Statistical	conversion converting change changing
∾y	Join array of arrays vertically	Expression	Structural	aboveandbelow stack merge flatten column-wise columnwise
1|n	Fractional part of number	Expression	Arithmetic	decimals
1000|ia	Last part of packed numeric code ABBB	Expression	Specialty	unpack converting change changing
2|j	Parity of j (is j odd?)	Expression	Combinatorics	testif
256|j	Convert from signed short integers to unsigned short integers	Expression	Fixed-Width	datarepresentation converting change changing
0↓y	Ensure minimum rank 1 (reshaping unit into one-element list)	Expression	Structural	unscalarise unscalarize 1-element 1element minimumrank1 makenonscalarise nonscalarize list ravel-if-scalar
1↑y2	First row as a length-1 table	Expression	Selection	topmostrow leading 1st table list start beginning
¯1↑y2	Last row as a length-1 table	Expression	Selection	bottommostrow trailing table list ending
1⌽y	Rightmost neighbouring elements, wrapping cyclically	Expression	Selection	neighbours neighbors lefthand bitshift cells items
¯1⌽y	Leftmost neighbouring elements, wrapping cyclically	Expression	Selection	neighboring neighbours neighbors lefthand bitshift cells items
x⊢y	Church Boolean false (x if false, else y)	Tacit	Functional	falsy falsey 0
x⊣y	Church Boolean true (x if true, else y)	Tacit	Functional	truthy 1
1˘y2	List having as many ones as y2 has rows	Tacit	Data	1s trues truths list
0¨y	Zeros with same shape as y	Tacit	Data	zeroes naughts 0s falses falsehoods
x0¨y	Fill array y with data value x0	Tacit	Data	
0/y	Empty array along first axis	Expression	Structural	dimension 1st
¯1⊑y1	Last element of list y1	Expression	Selection	element cell list
0⌈m⌊n	Clamp numbers n to range 0≤n≤m	Expression	Data	force restrictrange between 0–
x0⌈y0⌊z	Force z to range x0≤z≤y0	Expression	Data	clamp limitrange between –
0==y	Is y a unit?	Expression	Structural	testif
1==y	Is y a list?	Expression	Structural	testif rank1
x«»y	Replace last major cell of y with x0 (slow)	Tacit	Structural	substitute merge amend replace update item element
∾≍y1	Join elements of y1 along the second axis	Expression	Structural	combine merge joinhorizontally cells elements dimensions
0=≡y	Is y an atom?	Expression	Structural	testif simple?
1=≡y	Is y an array of atoms?	Expression	Structural	testif simple?
1+↕j0	Integers from 1 to j0	Expression	Sequences	whole numbers naturals 1st
m0×↕j0	Arithmetic progression vector: j0 steps of m0	Expression	Sequences	sequence
↕=y	All axes of array y	Expression	Indices	dimensions
0=i|j	Does i divide j?	Expression	Number Theory	testif divides divisibility divisor ∣
0≠i|j	Does i not divide j?	Expression	Number Theory	testif divisibility divisor ∤ dividing
¬2|j	Is j even?	Expression	Combinatorics	
1||n	Magnitude of fractional part of n	Expression	Arithmetic	absolutedecimals
0‿0↓y	Increase rank of y to at least 2 by adding length-1 leading axes	Expression	Structural	number of dimensions 2D axes matrify matricise matricize make
1↓≢y	Dimensions of major cells	Expression	Array	shape items elements axes
¯1↓≢y	Lengths of leading axes	Expression	Array	shape dimensions start beginning
+˜n	Double: 2×n	Tacit	Arithmetic	twice
×˜n	Square: n⋆2	Tacit	Arithmetic	² ^2
=˜y	Ones, same shape and structure	Tacit	Data	1s trues truths
≠˜y	Zeros, same shape and structure	Tacit	Data	zeroes naughts 0s falses falsehoods
∧˘y	Sort each major cell ascending	Tacit	Ordering	elements items sort() up increasing sorting reordering
∨˘y	Sort each major cell descending	Tacit	Ordering	elements items sort() down decreasing sorting reordering
<˘y2	Table to list of rows	Tacit	Structural	spike downarrow split lists from array into nested nesting rank depth unflatten
»˘y2	Leftmost neighbouring elements, padding at edge	Tacit	Selection	neighboring neighbours neighbors lefthand bitshift cells items
«˘y2	Rightmost neighbouring elements, padding at edge	Tacit	Selection	neighbours neighbors neighboring lefthand bitshift cells items
1∾˘y2	Preface a column of 1s	Expression	Structural	ones trues truths
x2∾˘y0	Append unit to each row of table	Tacit	Structural	extend with next merge join concatenate rows table connect
x2∾˘y1	Append elements of list to respective rows of table	Tacit	Structural	extend with next merge join concatenate table list connect
y2∾˘1	Append a column of 1s	Expression	Structural	ones trues truths
≍˘y	Increment rank by inserting a new dimension after the first	Tacit	Structural	additional dimensions axes axis items elements cells extend shape beginning first 1st
≍˘y1	Reshape list y1 into a one-column table	Tacit	Structural	1-column table list
x1≍˘y1	Two-column table from two lists	Tacit	Structural	table lists columns
i0↓˘y2	Drop i0 columns from y2	Tacit	Structural	table delete remove without
1↑˘y2	First column as a column matrix	Expression	Selection	leftmostcolumn leading 1st table list start beginning
i0↑˘y2	Adjust table y2 to width |i0 by truncating or padding rows	Tacit	Structural	fill limit
¯1↑˘y2	Last column as a column matrix	Expression	Selection	rightmostcolumn trailing table list ending
⌽˘y2	Reflect vertically	Tacit	Structural	mirroring reflecting reflection right-left rightleft leftright left-right
x∾¨y	Join corresponding elements	Tacit	Structural	juxtapose tuples cells elements zip pair
i0/≍y	Array where the major cells are i0 repeated copies of y1	Expression	Structural	fill tile copy duplicate add new axis dimension increase incrementing rank by 1 one
i0/≍y1	Table with i0 rows, each consisting of y1	Expression	Structural	table fill tile repeat copy duplicate
i0⊏∧y	i0'th-smallest major cell of y	Expression	Selection	leastof minimum lexicographically item element
i0⊏∨y	i0'th-largest major cell of y	Expression	Selection	greatestof maximum biggest lexicographically item element
⊏i0⌽y	Select major cell of y at cyclic offset i0 (default i0:¯1)	Tacit	Selection	element item
i1⊏˜j1	Generate consolidated left argument for successive transposes i1⍉j1⍉y	Tacit	Structural	
a0⊑x‿y	Pick y if a0 is true or x if a0 is false	Expression	Selection	conditional selector pick choose
¯1⊑≢y	Length of last axis, assuming at least one axis	Expression	Array	count length() cells len() elements dimension ending
¯1⊑≢y2	Number of columns in y2	Expression	Array	trailingshape
⊑i0⌽y1	Pick element of list y1 at cyclic offset i0	Expression	Selection	element cell list ⎕ioindependent ⎕ioindependence ⎕io-insensitive ⎕ioinsensitive Choosing choose ⎕io=0
⊑/b	Index of first satisfied condition in b	Expression	Search	1st
i1⥊<y	Array of shape i1 filled with copies of y	Expression	Structural	copy repeat repetitions duplicate reshape
0‿j0⥊0	Initialise a table with j0 columns and no rows	Expression	Structural	table
↕2⥊2	Unit square	Constant	Geometric	
↕3⥊2	Unit cube	Constant	Geometric	
↕4⥊2	Unit tesseract	Constant	Geometric	
⥊↕y1	All ordered tuples choosing elements from ↕¨y1	Expression	Indices	indices major cells items
i0↑j0⥊1	Prefix List: length i0 with j0 ones on the left, the rest zeroes	Expression	Data	1s 0s zeros Is𝕨Js falses falsehoods trues truths
⥊˘y	Convert to rank 2 array by flattening each cell to a row	Tacit	Structural	commabar ravelcells flattencells razecells Merge demoterank lessenrank reduce reducing
i0⥊˘y1	Table with i0 columns, each consisting of y1	Tacit	Structural	fill table
⥊¨y	Ensure that all elements are lists	Tacit	Structural	items elements cells lists uniformity make force to be
x F∘⊢ y	Ignore left argument and call F monadically on y	Tacit	Function Application	to from dummy onrightargument
x F∘⊣ y	Ignore right argument and call F monadically on x	Tacit	Function Application	to from dummy onleftargument
1⊸+n	Increment: n+1	Tacit	Arithmetic	increase next
3⊸×n	Triple: 3×n	Tacit	Arithmetic	thrice
0⊸=n	Zero?	Tacit	Arithmetic	testif
0⊸≠n	Non-zero?	Tacit	Arithmetic	testif nonzero?
0⊸<n	Strictly positive?	Tacit	Arithmetic	testif
0⊸>n	Strictly negative?	Tacit	Arithmetic	testif
0⊸≤n	Non-negative?	Tacit	Arithmetic	testif nonnegative?
0⊸≥n	Non-positive?	Tacit	Arithmetic	testif nonpositive?
1⊸↓y	Behead: Remove first major cell	Tacit	Selection	drop chop leading element item 1st delete start beginning without
¯1⊸↓y	Curtail: Remove last major cell	Tacit	Selection	drop chop trailing element item delete ending without
F⊸⊢y	Apply function F but discard result and return the original value	Tacit	Function Application	is-yfunction do-yfunction enpassant noresult isyfunction doyfunction
F⊸/y	Filter to only those elements of y that satisfy cell-wise criterion F	Expression	Selection	filtering where cells items
¯1⊸⊏y	Tail: Last major cell	Tacit	Selection	y[-1] x[-1] y[¯1] x[¯1] trailing element item ending
-⟜1 n	Decrement	Tacit	Arithmetic	decrease previous
÷⟜2 n	Halve: n÷2	Tacit	Arithmetic	halfof
÷⟜F n	Normalise, scaling so that the norm F is equal to 1	Expression	Data	normalise arbitrary custom F=1 vector list
x F⊸G⟜H y	Split-Compose: apply G between (F x) and (H y), that is (F x) G (H y)	Tacit	Composition	composewith splitover (fX)G(hY) (fX)ghY
x⌾⊏y	Replace first major cell of y with x	Expression	Structural	substitute merge amend replace update 1st item element
F⌾⥊y	Handle array y temporarily as a list	Tacit	Function Application	columnheadings columnnumbers ⍢, flattened ravelled raveled list
/⁼j1	Convert set of indices j1 to a mask	Tacit	Indices	indicate masking indicating bitmask bit-mask converting change changing
i1+⌜j1	Addition table for i1 down and j1 across	Tacit	Arithmetic	additiontable cartesianaddition plustable matrix
i1×⌜j1	Multiplication table for i1 down and j1 across	Tacit	Arithmetic	multiplicationtable cartesianproduct timestable matrix
x⋈⌜y	Cartesian product: all pairs from x and y	Tacit	Structural	catalog pairings tuples table matrix
+´n1	Sum of n1	Tacit	Data	summation enlargedsigma bigsigma capitalsigma ∑ Σ sum() horizontally rowwise
×´n1	Product of n1	Tacit	Data	enlargedpi bigpi capitalpi ∏ Π horizontally rowwise
×´n1	Area of rectangle with sides n1	Tacit	Geometric	edge lengths
×´n1	Volume of box with sides n1	Tacit	Geometric	block edge lengths
∧´b1	Are all true?	Tacit	Boolean	forall? ∀ binary base-2 base2 testif
∨´b1	Are any true?	Tacit	Boolean	anyone? thereexists ∃ horizontally rowwise testif forany?
⌈´n1	Maximum of n1	Tacit	Data	supremum biggest largest highest greatest
0⌈´n	Positive maximum, at least zero even for empty n	Expression	Data	largest biggest
⌊´n1	Minimum of n1	Tacit	Data	infirmum smallest lowest least
÷´n1	Alternating product of n1	Tacit	Arithmetic	
≠´b1	Parity of boolean list: are there an odd number of 1s?	Tacit	Boolean	
F´x‿y	Apply dyadic function as a monadic function on a two-element argument	Tacit	Function Application	calling runing converting change changing switching valence arity into dyad-to-monad dyadic-to-monadic binary-to-unary
F´⥊y	Fold F over all elements without respect to shape	Expression	Function Application	reduce insert over rowwise reducing folding row-wise horizontally remove
+˝n	Column-wise sum of n	Tacit	Data	summation enlargedsigma bigsigma capitalsigma ∑ Σ vertically columnwise
-˝n	Column-wise alternating sum: ((n_0-n_1)+n_2)-n_3+…	Tacit	Data	alternatingsum series vertically columnwise
×˝n	Column-wise product of n	Tacit	Data	enlargedpi bigpi capitalpi ∏ Π vertically columnwise
∾˝y	Combine first two axes of y	Tacit	Structural	Merge demoterank lessenrank reduce flatten reducing table
⊢˝y	Last cell of y	Tacit	Selection	topmostrow subarray dimension 1st
+`n	Cumulative sum	Tacit	Data	runningtotal
∧`b	Turn off all 1s after first 0, or indicate all elements until the first 0	Tacit	Boolean	indicating flipping turning change changing inverting negating bitmask bit-mask ones zero trues truths falsehood 1st
∨`b	Turn on all 1s after first 1, or indicate all elements except leading 0s	Tacit	Boolean	indicating flipping turning change changing inverting negating bitmask bit-mask zeros zeroes trues truths ones falses falsehoods 1st start beginning not
⌈`n	Column-wise progressive maxima	Tacit	Data	running cumulative scan columnwise vertically
⌊`n	Column-wise progressive minima	Tacit	Data	running cumulative scan columnwise vertically
≠`b	Convert reflected Gray code to binary	Tacit	Boolean	flip change changing inverting negating bitmask bit-mask base-2 base2 Conversion converting
≠`b	Parity: Connect odd and even ones	Tacit	Boolean	flip change changing inverting negating bitmask bit-mask 1s running trues truths
<`b	Indicate 1s preceded by an even number of 1s in their group	Tacit	Partitioning	indicating flipping turning change changing inverting negating bitmask bit-mask zeros zeroes falses ones trues truths falsehoods 1st
n×¯1⋆a	Change sign of n where a is 1	Expression	Arithmetic	signum conditionalnegation changing converting conversion element-wise
10⊸⋆n	Common anti-logarithm	Tacit	Arithmetic	log⁻¹() log^1() lg⁻¹() lg10^1() log10⁻¹() log10^1() lg10⁻¹() log₁₀⁻¹() log₁₀^1() lg₁₀⁻¹() lg₁₀^1() antilogarithm
⋆⟜3 n	Cube	Tacit	Arithmetic	³ ^3
⋆⁼n	Natural logarithm of n	Tacit	Arithmetic	naturallogarithm circlestar starcircle splat ln() lnₑ() logₑ()
m⋆⁼n	Base-m logarithm of n	Tacit	Arithmetic	logarithms logs circlestar starcircle splat log() log₁₀()
3⊸√n	Cube Root	Tacit	Arithmetic	squareroot cbrt ³√ ∛ ^0.333 ^.333 ^(1/3)
¬x∊y	Boolean elements in x that are not in y	Expression	Search	isnotin membership notcontainedin hasn't doesnothave elementof ∉ cells elements binary base-2 base2
m0∊↕n0	Is m0 in range 0…n0-1?	Expression	Data	inrange? valid? testif
